{"components":{"app":{"dead":3}},"contract":1,"counts":{"build":{"src":"facts/runtime.json#ci_step, deployment_target; facts/entrypoints.json#entry_point[surface=cli]","unit":"count","value":1},"config":{"src":"facts/config.json#env_read (distinct names), config_key[secret_shaped], config_file_unread; facts/secrets.json","unit":"count","value":0},"dead":{"src":"facts/deadcode.json#engine_finding; facts/leftovers.json#leftover; facts/broken.json#broken_code","unit":"count","value":3},"dialogs":{"src":"facts/graph.json#graph_node named …Dialog, …Form, …Modal, …Sheet, …Drawer, rendered by a screen","unit":"count","value":0},"no_screen":{"src":"items of triggers, server, writes, outside and config no screen reaches by three import steps","unit":"count","value":0},"outside":{"src":"facts/runtime.json#integration_target (distinct hosts)","unit":"count","value":0},"screens":{"src":"studio/journeys.json#screens[kind in layout, redirect, fallback]","unit":"count","value":0},"seen":{"src":"studio/journeys.json#screens[kind=page]","unit":"count","value":0},"server":{"src":"facts/entrypoints.json#entry_point[surface=http]","unit":"count","value":0},"triggers":{"src":"facts/entrypoints.json#entry_point[surface in job, container; http hook routes]; facts/graph.json#graph_node under supabase/functions, netlify/functions, api/cron","unit":"count","value":0},"unseen":{"src":"every item of the unseen groups","unit":"count","value":4},"writes":{"src":"facts/entrypoints.json#data_access[operation in post, put, patch, delete, insert, update, upsert, remove, rpc]","unit":"count","value":0}},"groups":[{"capped":0,"count":{"src":"facts/entrypoints.json#entry_point[surface in job, container; http hook routes]; facts/graph.json#graph_node under supabase/functions, netlify/functions, api/cron","unit":"count","value":0},"id":"triggers","items":[],"kinds":{},"no_screen":0},{"capped":0,"count":{"src":"studio/journeys.json#screens[kind in layout, redirect, fallback]","unit":"count","value":0},"id":"screens","items":[],"kinds":{},"no_screen":0},{"capped":0,"count":{"src":"facts/entrypoints.json#entry_point[surface=http]","unit":"count","value":0},"id":"server","items":[],"kinds":{},"no_screen":0},{"capped":0,"count":{"src":"facts/entrypoints.json#data_access[operation in post, put, patch, delete, insert, update, upsert, remove, rpc]","unit":"count","value":0},"id":"writes","items":[],"kinds":{},"no_screen":0},{"capped":0,"count":{"src":"facts/runtime.json#integration_target (distinct hosts)","unit":"count","value":0},"id":"outside","items":[],"kinds":{},"no_screen":0},{"capped":0,"count":{"src":"facts/config.json#env_read (distinct names), config_key[secret_shaped], config_file_unread; facts/secrets.json","unit":"count","value":0},"id":"config","items":[],"kinds":{},"no_screen":0},{"capped":0,"count":{"src":"facts/runtime.json#ci_step, deployment_target; facts/entrypoints.json#entry_point[surface=cli]","unit":"count","value":1},"id":"build","items":["build:command:shop:pyproject.toml:5"],"kinds":{"command":1},"no_screen":0},{"capped":0,"count":{"src":"facts/deadcode.json#engine_finding; facts/leftovers.json#leftover; facts/broken.json#broken_code","unit":"count","value":3},"id":"dead","items":["dead:unreachable-module:app/old_export.py:app/old_export.py:1","dead:unreachable-module:app/old_mail.py:app/old_mail.py:1","dead:unreachable-module:app/old_report.py:app/old_report.py:1"],"kinds":{"unreachable-module":3},"no_screen":0}],"items":[{"areas":[],"card":null,"component":null,"detail":"console_script","fact":"FACT-dd66bb9bf5dfe73d","file":"pyproject.toml","files":["pyproject.toml"],"group":"build","id":"build:command:shop:pyproject.toml:5","kind":"command","line":5,"name":"shop","no_screen":false},{"areas":[],"card":"TASK-001","component":"app","detail":null,"fact":"FACT-003ba15513636d67","file":"app/old_export.py","files":["app/old_export.py"],"group":"dead","id":"dead:unreachable-module:app/old_export.py:app/old_export.py:1","kind":"unreachable-module","line":1,"name":"app/old_export.py","no_screen":false},{"areas":[],"card":"TASK-002","component":"app","detail":null,"fact":"FACT-454d27e501cc7952","file":"app/old_mail.py","files":["app/old_mail.py"],"group":"dead","id":"dead:unreachable-module:app/old_mail.py:app/old_mail.py:1","kind":"unreachable-module","line":1,"name":"app/old_mail.py","no_screen":false},{"areas":[],"card":"TASK-003","component":"app","detail":null,"fact":"FACT-0de6b2b4ef840623","file":"app/old_report.py","files":["app/old_report.py"],"group":"dead","id":"dead:unreachable-module:app/old_report.py:app/old_report.py:1","kind":"unreachable-module","line":1,"name":"app/old_report.py","no_screen":false}],"links":[],"missing":[],"revision":2,"schema_version":1,"seen":[],"src":{"build":"facts/runtime.json#ci_step, deployment_target; facts/entrypoints.json#entry_point[surface=cli]","config":"facts/config.json#env_read (distinct names), config_key[secret_shaped], config_file_unread; facts/secrets.json","dead":"facts/deadcode.json#engine_finding; facts/leftovers.json#leftover; facts/broken.json#broken_code","dialogs":"facts/graph.json#graph_node named …Dialog, …Form, …Modal, …Sheet, …Drawer, rendered by a screen","no_screen":"items of triggers, server, writes, outside and config no screen reaches by three import steps","outside":"facts/runtime.json#integration_target (distinct hosts)","screens":"studio/journeys.json#screens[kind in layout, redirect, fallback]","seen":"studio/journeys.json#screens[kind=page]","server":"facts/entrypoints.json#entry_point[surface=http]","triggers":"facts/entrypoints.json#entry_point[surface in job, container; http hook routes]; facts/graph.json#graph_node under supabase/functions, netlify/functions, api/cron","writes":"facts/entrypoints.json#data_access[operation in post, put, patch, delete, insert, update, upsert, remove, rpc]"}}